Connected.
SQL> select*from cricketboard
  2
SQL> select*from cricketboard;

BOARDID    NAME                           ADDRESS
---------- ------------------------------ ------------------------------
   CONTACT
----------
bid101     chennaic.b                     chennai
9959153797

bid102     andhrac.b                      andhra
9490880438

bid103     tamilnaduc.b                   tamilnadu
8074183293


BOARDID    NAME                           ADDRESS
---------- ------------------------------ ------------------------------
   CONTACT
----------
bid104     delhic.b                       delhi
9959143268


SQL> select*from team;

TEAMID BOARDID    NAME                           COACH
------ ---------- ------------------------------ ------------------------------
CAPTAIN
------------------------------
t1     bid101     green                          bhavya
sri

t2     bid102     black                          vasu
satya

t3     bid103     pooja                          madhu
gopi


TEAMID BOARDID    NAME                           COACH
------ ---------- ------------------------------ ------------------------------
CAPTAIN
------------------------------
t4     bid104     yellow                         dhana
kavya


SQL> select*from player;

PLAYE FNAME                       AGE
----- -------------------- ----------
p1    ajay                         23
p2    ram                          25
p4    satya                        25
p3    tarun                        23

SQL> create table match(matchid varchar(10),teamid varchar(20),playerid varchar(6),matchdate DATE);

Table created.

SQL> insert into match values('&matchid','&teamid','&playerid','&matchdate');
Enter value for matchid: m1
Enter value for teamid: t1
Enter value for playerid: p1
Enter value for matchdate: 06/05/2007
old   1: insert into match values('&matchid','&teamid','&playerid','&matchdate')
new   1: insert into match values('m1','t1','p1','06/05/2007')
insert into match values('m1','t1','p1','06/05/2007')
                                        *
ERROR at line 1:
ORA-01843: not a valid month


SQL> drop table match;

Table dropped.

SQL> create table match(matchid varchar(10),teamid varchar(20),playerid varchar(6),match_date DATE);

Table created.

SQL> insert into match values('&matchid','&teamid','&playerid','&match_date');
Enter value for matchid: M1
Enter value for teamid: T1
Enter value for playerid: P1
Enter value for match_date: 06_07_2006
old   1: insert into match values('&matchid','&teamid','&playerid','&match_date')
new   1: insert into match values('M1','T1','P1','06_07_2006')
insert into match values('M1','T1','P1','06_07_2006')
                                        *
ERROR at line 1:
ORA-01843: not a valid month


SQL> DROP TABLE MATCH;

Table dropped.

SQL> create table match(matchid varchar(10),teamid varchar(20),playerid varchar(6));

Table created.

SQL> insert into match values('&matchid','&teamid','&playerid');
Enter value for matchid: M1
Enter value for teamid: T1
Enter value for playerid: P1
old   1: insert into match values('&matchid','&teamid','&playerid')
new   1: insert into match values('M1','T1','P1')

1 row created.

SQL> /
Enter value for matchid: M2
Enter value for teamid: T2
Enter value for playerid: P2
old   1: insert into match values('&matchid','&teamid','&playerid')
new   1: insert into match values('M2','T2','P2')

1 row created.

SQL> /
Enter value for matchid: M3
Enter value for teamid: T3
Enter value for playerid: P3
old   1: insert into match values('&matchid','&teamid','&playerid')
new   1: insert into match values('M3','T3','P3')

1 row created.

SQL> /
Enter value for matchid: M4
Enter value for teamid: T4
Enter value for playerid: P4
old   1: insert into match values('&matchid','&teamid','&playerid')
new   1: insert into match values('M4','T4','P4')

1 row created.

SQL> SELECT * FROM MATCH;

MATCHID    TEAMID               PLAYER
---------- -------------------- ------
M1         T1                   P1
M2         T2                   P2
M3         T3                   P3
M4         T4                   P4

SQL> create table ground(groundid varchar(10) PRIMARY KEY,matchid varchar(10),name varchar(30),location varchar(30));

Table created.

SQL> insert into ground values('&groundid','&matchid','&name','&location');
Enter value for groundid: g1
Enter value for matchid: m1
Enter value for name: bhavya
Enter value for location: chennai
old   1: insert into ground values('&groundid','&matchid','&name','&location')
new   1: insert into ground values('g1','m1','bhavya','chennai')

1 row created.

SQL> /
Enter value for groundid: g2
Enter value for matchid: m2
Enter value for name: madhu
Enter value for location: vijayawada
old   1: insert into ground values('&groundid','&matchid','&name','&location')
new   1: insert into ground values('g2','m2','madhu','vijayawada')

1 row created.

SQL> /
Enter value for groundid: g3
Enter value for matchid: m3
Enter value for name: bunny
Enter value for location: bangalore
old   1: insert into ground values('&groundid','&matchid','&name','&location')
new   1: insert into ground values('g3','m3','bunny','bangalore')

1 row created.

SQL> /
Enter value for groundid: g4
Enter value for matchid: m4
Enter value for name: satya
Enter value for location: eluru
old   1: insert into ground values('&groundid','&matchid','&name','&location')
new   1: insert into ground values('g4','m4','satya','eluru')

1 row created.

SQL> select * from ground;

GROUNDID   MATCHID    NAME
---------- ---------- ------------------------------
LOCATION
------------------------------
g1         m1         bhavya
chennai

g2         m2         madhu
vijayawada

g3         m3         bunny
bangalore


GROUNDID   MATCHID    NAME
---------- ---------- ------------------------------
LOCATION
------------------------------
g4         m4         satya
eluru


SQL> create table umpire(umpireid varchar(10) PRIMARY KEY,fname varchar(30),date of birth date,country varchar(30),email varchar(40),contactno number);
create table umpire(umpireid varchar(10) PRIMARY KEY,fname varchar(30),date of birth date,country varchar(30),email varchar(40),contactno number)
                                                                       *
ERROR at line 1:
ORA-00904: : invalid identifier


SQL> create table umpire(umpireid varchar(10) PRIMARY KEY,fname varchar(30),country varchar(30),email varchar(40),contactno number);

Table created.

SQL> insert into umpire values('&umpireid','&fname','&country','&email','&contactno');
Enter value for umpireid: u1
Enter value for fname: madhu
Enter value for country: india
Enter value for email: madhu@gmail.com
Enter value for contactno: 9163782532
old   1: insert into umpire values('&umpireid','&fname','&country','&email','&contactno')
new   1: insert into umpire values('u1','madhu','india','madhu@gmail.com','9163782532')

1 row created.

SQL> /
Enter value for umpireid: u2
Enter value for fname: bhavya
Enter value for country: india
Enter value for email: bhavya@gmail.com
Enter value for contactno: 916648253
old   1: insert into umpire values('&umpireid','&fname','&country','&email','&contactno')
new   1: insert into umpire values('u2','bhavya','india','bhavya@gmail.com','916648253')

1 row created.

SQL> /
Enter value for umpireid: u3
Enter value for fname: gopi
Enter value for country: pakisthan
Enter value for email: gopi@gmail.com
Enter value for contactno: 7013703422
old   1: insert into umpire values('&umpireid','&fname','&country','&email','&contactno')
new   1: insert into umpire values('u3','gopi','pakisthan','gopi@gmail.com','7013703422')

1 row created.

SQL> /
Enter value for umpireid: u4
Enter value for fname: sweety
Enter value for country: india
Enter value for email: sweety@gmail.com
Enter value for contactno: 7093967934
old   1: insert into umpire values('&umpireid','&fname','&country','&email','&contactno')
new   1: insert into umpire values('u4','sweety','india','sweety@gmail.com','7093967934')

1 row created.

SQL> select*from umpire;

UMPIREID   FNAME                          COUNTRY
---------- ------------------------------ ------------------------------
EMAIL                                     CONTACTNO
---------------------------------------- ----------
u1         madhu                          india
madhu@gmail.com                          9163782532

u2         bhavya                         india
bhavya@gmail.com                          916648253

u3         gopi                           pakisthan
gopi@gmail.com                           7013703422


UMPIREID   FNAME                          COUNTRY
---------- ------------------------------ ------------------------------
EMAIL                                     CONTACTNO
---------------------------------------- ----------
u4         sweety                         india
sweety@gmail.com                         7093967934


SQL> select location from ground where matchid='m4';

LOCATION
------------------------------
eluru

SQL> select * from player where fname like 'm%';

no rows selected

SQL> select * from player where fname like 'a%';

PLAYE FNAME                       AGE
----- -------------------- ----------
p1    ajay                         23

SQL> alter table player add batting varchar(20);

Table altered.

SQL> alter table player add bowling varchar(10);

Table altered.

SQL> select * from cricketboard where boardid in('bid101','bid102','bid103');

BOARDID    NAME                           ADDRESS
---------- ------------------------------ ------------------------------
   CONTACT
----------
bid101     chennaic.b                     chennai
9959153797

bid102     andhrac.b                      andhra
9490880438

bid103     tamilnaduc.b                   tamilnadu
8074183293


SQL> select a.umpireid from umpire a where umpireid NOT IN (select umpireid from umpire_umpireid);
select a.umpireid from umpire a where umpireid NOT IN (select umpireid from umpire_umpireid)
                                                                            *
ERROR at line 1:
ORA-00942: table or view does not exist


SQL> select umpireid from umpire  where umpireid not in(select umpireid from umpire_umpireid);
select umpireid from umpire  where umpireid not in(select umpireid from umpire_umpireid)
                                                                        *
ERROR at line 1:
ORA-00942: table or view does not exist


SQL> select*from player;

PLAYE FNAME                       AGE BATTING              BOWLING
----- -------------------- ---------- -------------------- ----------
p1    ajay                         23
p2    ram                          25
p4    satya                        25
p3    tarun                        23

SQL> insert into player values where batting=('rh','lh','rh','lh');
insert into player values where batting=('rh','lh','rh','lh')
                          *
ERROR at line 1:
ORA-00936: missing expression


SQL> insert into player(batting ,bowling)values('righthand','lefthand');

1 row created.

SQL> insert into player(batting ,bowling)values('lefthand');
insert into player(batting ,bowling)values('lefthand')
                                    *
ERROR at line 1:
ORA-00947: not enough values


SQL> /
insert into player(batting ,bowling)values('lefthand')
                                    *
ERROR at line 1:
ORA-00947: not enough values


SQL> insert into player(batting ,bowling)values('lefthand','righthand');

1 row created.

SQL> select * from player;

PLAYE FNAME                       AGE BATTING              BOWLING
----- -------------------- ---------- -------------------- ----------
p1    ajay                         23
p2    ram                          25
p4    satya                        25
p3    tarun                        23
                                      righthand            lefthand
                                      lefthand             righthand

6 rows selected.

SQL> update player set batting='righthand' where playerid='p1';

1 row updated.

SQL> update player set batting='lefthand' where playerid='p2';

1 row updated.

SQL> update player set batting='lefthand' where playerid='p4';

1 row updated.

SQL> update player set bowling='lefthand' where playerid='p4';

1 row updated.

SQL> update player set bowling='lefthand' where playerid='p2';

1 row updated.

SQL> update player set bowling='righthand' where playerid='p1';

1 row updated.

SQL> update player set playerid='p5' batting='righthand';
update player set playerid='p5' batting='righthand'
                                *
ERROR at line 1:
ORA-00933: SQL command not properly ended


SQL> select *from player;

PLAYE FNAME                       AGE BATTING              BOWLING
----- -------------------- ---------- -------------------- ----------
p1    ajay                         23 righthand            righthand
p2    ram                          25 lefthand             lefthand
p4    satya                        25 lefthand             lefthand
p3    tarun                        23
                                      righthand            lefthand
                                      lefthand             righthand

6 rows selected.

SQL> select count(*)from player where batting ='righthand';

  COUNT(*)
----------
         2

SQL> select playerid,fname from player where bowling='lefthand';

PLAYE FNAME
----- --------------------
p2    ram
p4    satya
